project_id,winning_date,winning_notice_url,order_id,winning_order_cnt,project_winning_amt,supplier_name,supplier_addr,order_name,winning_amt,cadidate_name,buyer_name,buyer_addr,buyer_contact,buyer_phone,agency_name,agency_addr,agency_contact,agency_phone,source_id
11010822210200000516-XM001,2022年04月25日 17:16,http://www.ccgp.gov.cn/cggg/dfgg/zbgg/202204/t20220425_17823996.htm,1,1,,北京东方中科达科技有限公司中标成交,,北京市上地实验学校九年一贯制改扩建配套教室设备及家具购置,,,北京市上地实验学校,北京市海淀区上地二街3号,"陈老师,010-62975190-3025",,北京国际招标有限公司,北京市东城区朝阳门北小街71号,隋志亮、白辰、苏琳、李跃、游路群，电话：010-84045683（业务）；010-84045694（发票及退保证金）3,,1
11000022210200008954-XM001,2022年05月07日 16:19,http://www.ccgp.gov.cn/cggg/dfgg/zbgg/202205/t20220507_17871905.htm,1,1,,北京至成恒业科技发展有限公司中标成交,,国际城市交通服务专业群建设-实训室民航模块升级改造,,,北京市对外贸易学校,北京市朝阳区来广营水岸南街1号院,",84922517",,北京汇诚金桥国际招标咨询有限公司,北京市东城区朝内大街南竹竿杆胡同6号北京INN3号楼9层,郭文娜、张洁淳，652447293,,1
11000022210200008986-XM001,2022年05月07日 16:19,http://www.ccgp.gov.cn/cggg/dfgg/zbgg/202205/t20220507_17871910.htm,1,1,,北京世纪超星信息技术发展有限责任公司中标成交,,国际商务服务专业群-智慧教室建设,,,北京市对外贸易学校,北京市朝阳区来广营水岸南街1号院,",84923065",,北京汇诚金桥国际招标咨询有限公司,北京市东城区朝内大街南竹竿杆胡同6号北京INN3号楼9层,张洁淳，010-652447293,,1
11000022210200007754-XM001,2022年05月09日 13:09,http://www.ccgp.gov.cn/cggg/dfgg/zbgg/202205/t20220509_17877444.htm,1,1,,人卫嘉奕（上海）医学科技有限公司中标成交,,护理专业实训室建设采购项目,,,北京劳动保障职业学院,北京市朝阳区惠新东街5号(南校区),"李老师,010-64941931",,中天信远国际招投标咨询(北京)有限公司,北京市朝阳区南磨房路37号华腾北搪商务大厦11层1112室,成志凯、周姗、王师安、鲁智慧，134262008683,,1
11010822210200003050-XM001,2022年05月12日 14:26,http://www.ccgp.gov.cn/cggg/dfgg/zbgg/202205/t20220512_17898683.htm,1,1,,北京果果乐学科技有限公司中标成交,,[ID34296]北京市海淀区中关村第一小学科学城分校智慧校园（一期）建设其他服务采购项目,,,北京市海淀区中关村第一小学科学城分校,北京市海淀区温泉镇向山路,"邓翼涛,010-62551906",,北京科技园拍卖招标有限公司,北京市海淀区万柳光大西园6号楼,王思洋，82575731转2243,,1
11000022210200008040-XM001,2022年05月12日 14:32,http://www.ccgp.gov.cn/cggg/dfgg/zbgg/202205/t20220512_17898756.htm,1,1,,北京凌文众达科技有限公司中标成交,,改善办学条件软件教学实训室建设采购项目,,,北京劳动保障职业学院,北京市朝阳区惠新东街5号,"李老师,64941931",,北京国际工程咨询有限公司,北京市海淀区学院路30号科大天工大厦A座611室,仇老师，823727703,,1
11000022210200006340-XM001,2022年05月16日 14:58,http://www.ccgp.gov.cn/cggg/dfgg/zbgg/202205/t20220516_17914103.htm,1,1,,北京兴塔科技有限公司中标成交,,职业教育创新发展-实训基地（实训室）建设—金属3D打印实训室建设项目教学专用仪器采购项目,,,北京市自动化工程学校,北京市朝阳区德胜门外双泉堡白庙路甲2号,"易楠,64842057",,北京海德伟业人力资源管理咨询有限公司,北京市石景山区苹果园路28号中铁创业大厦A座803B,孙鹏，823186883,,1
11000022210200006339-XM001,2022年05月16日 14:58,http://www.ccgp.gov.cn/cggg/dfgg/zbgg/202205/t20220516_17914110.htm,1,1,,北京京西时代科技有限公司中标成交,,职业教育创新发展-实训基地（实训室）建设—文物复制工作室建设项目教学专用仪器采购项目,,,北京市自动化工程学校,北京市朝阳区德胜门外双泉堡白庙路甲2号,"易楠,64842057",,北京海德伟业人力资源管理咨询有限公司,北京市石景山区苹果园路28号中铁创业大厦A座803B,孙鹏，823186883,,1
LL-ZB-2022-004,2022年05月17日 11:02,http://www.ccgp.gov.cn/cggg/dfgg/zbgg/202205/t20220517_17920213.htm,1,1,,北京尚德慧聚科技有限公司,北京市房山区良乡凯旋大街建设路18号-D8080,首都经济贸易大学多媒体教室维护服务,59.6000000（万元）,,首都经济贸易大学,北京市丰台区花乡张家路口121号,陈老师，010-83952482,,北京奇泰桥工程技术咨询有限公司,北京市丰台区七里庄4号院1号楼2007室,张女士，83836797150102954583,,1
11000022210200008077-XM001,2022年05月18日 15:24,http://www.ccgp.gov.cn/cggg/dfgg/zbgg/202205/t20220518_17929311.htm,1,1,,北京政扬致冠科技有限公司中标成交,,精品录播教室建设,,,北京印刷学院,北京市大兴区兴华大街（二段）1号,"周同鑫,010-60261071",,中技国际招标有限公司,北京市西三环中路90号通用技术大厦,陈刚，010-633484933,,1
KJY20220679,2022年05月20日 09:28,http://www.ccgp.gov.cn/cggg/dfgg/zbgg/202205/t20220520_17940370.htm,1,1,,北京城建北方集团有限公司,北京市顺义区牛栏山镇牛板路2号,教学业务用房等修缮类项目-北京第一实验学校专业教室装修改造,3389.8934490（万元）,,北京第一实验学校,北京市通州区宋庄疃里南区55号楼,联系人：林森，电话：010-89591465,,北京科技园拍卖招标有限公司,北京市海淀区万柳光大西园6号楼,联系人：陈冲锋，电话：185117050703,,1
11000022210200004518-XM001,2022年05月25日 15:57,http://www.ccgp.gov.cn/cggg/dfgg/zbgg/202205/t20220525_17967419.htm,1,1,,北京知行捷云科技有限公司中标成交,,特高项目-软件与信息服务专业群-大数据创新应用实训室建设项目行业应用软件开发服务采购项目,,,北京信息职业技术学院（北京市电子工业党校）,北京市朝阳区芳园西路5号,"张治斌,85305707",,中海华咨询有限公司,北京市东城区新中街68号聚龙花园1号楼101,许鹏飞，010-856375863,,1
11000022210200004239-XM001,2022年05月25日 15:57,http://www.ccgp.gov.cn/cggg/dfgg/zbgg/202205/t20220525_17967424.htm,1,1,,北京金戈大通通信技术有限公司中标成交,,双高项目-信息安全与管理专业群-5G移动通信网络实训室建设项目,,,北京信息职业技术学院（北京市电子工业党校）,北京市朝阳区芳园西路5号,"纪兆华,85305678",,中海华咨询有限公司,北京市东城区新中街68号聚龙花园1号楼101,许鹏飞，010-856375863,,1
PXM2021_014261_000011-JH001-XM001,2022年02月16日 11:26,http://www.ccgp.gov.cn/cggg/dfgg/zbgg/202202/t20220216_17595793.htm,1,1,,鑫源恒升（北京）科技有限公司中标成交,,职业教育创新发展—实训基地（实训室）建设—天佑工程师核心素养教育基地建设教学专用仪器采购项目,,,北京铁路电气化学校,北京市昌平区南口镇文化路1号,"李老师,010-60797798",,国金招标有限公司,北京市朝阳区东三环南路甲52号顺迈金钻国际商务中心9层9C,杨振豪、张金鑫，010-562269763,,1
PXM2021_014261_000011-JH002-XM001,2022年02月16日 11:31,http://www.ccgp.gov.cn/cggg/dfgg/zbgg/202202/t20220216_17595862.htm,"1,2,3",3,,"北京京鸿鸿运科技发展有限公司中标成交,北京融信华泰软件技术有限公司中标成交,亮剑开拓科技发展（北京）有限公司中标成交",,职业教育创新发展—实训基地(实训室)建设—天佑工程师核心素养教育基地建设教学专用仪器采购项目,,,北京铁路电气化学校,北京市昌平区南口镇文化路1号,"李老师,010-60797798",,国金招标有限公司,北京市朝阳区东三环南路甲52号顺迈金钻国际商务中心9层9C,杨振豪、张金鑫，010-562269763,,1
0610-2241NH020027,2022年03月16日 17:27,http://www.ccgp.gov.cn/cggg/dfgg/zbgg/202203/t20220316_17675302.htm,1,1,,北京正世科技有限公司,,北京理工大学附属中学教学设备采购及录课教室建设,,,北京理工大学附属中学,北京市海淀区车道沟东路1号,刘老师010-53205801,,北京国际招标有限公司,北京市东城区朝阳门北小街71号,隋志亮、白辰、苏琳、李跃、游路群010-84045683（业务咨询）；010-84045694（发票及退保证金）3,,1
11000022210200001078-XM001,2022年03月25日 15:13,http://www.ccgp.gov.cn/cggg/dfgg/zbgg/202203/t20220325_17703940.htm,1,1,,中国建筑设计研究院有限公司、EDUCATIONDESIGNINTERNATIONALINC联合体中标成交,,教学业务用房等修缮类项目-北京第一实验学校专业教室装修改造（设计）,,,北京第一实验学校,北京市通州区宋庄疃里南区55号楼,"林森,010-88628022",,北京科技园拍卖招标有限公司,北京市海淀区万柳光大西园6号楼,王思洋，139102387833,,1
BIECC-22ZB0080/清设招第2022029,2022年03月25日 18:00,http://www.ccgp.gov.cn/cggg/zygg/zbgg/202203/t20220325_17705959.htm,1,1,,北京全德隆创意家具有限公司,北京市通州区张家湾镇后街村236号,清华大学附属小学双清苑校区教学家具专用教室家具采购项目,321.2120000（万元）,,清华大学,北京市海淀区清华大学，邮编100084,郭老师62781772,,北京国际工程咨询有限公司,北京市海淀区学院路30号科大天工大厦A座611,王蕾蕾、刘佳、梁超010-823735323,,1
11000022210200004912-XM001,2022年04月01日 14:33,http://www.ccgp.gov.cn/cggg/dfgg/zbgg/202204/t20220401_17728345.htm,1,1,,北京众邦互联科技有限公司中标成交,,曹妃甸实训基地VR虚拟现实实训教室设备采购项目其他终端设备采购项目,,,北京市工艺美术高级技工学校,北京市昌平区马池口镇白浮村,"王老师,010-60773939",,北京国际招标有限公司,北京市东城区朝阳门北小街71号,胡家俊；隋志亮；白辰；苏琳；游路群，840466303,,1