,project_id,winning_date,winning_notice_url,order_id,winning_order_cnt,project_winning_amt,supplier_name,supplier_addr,order_name,winning_amt,cadidate_name,buyer_name,buyer_addr,buyer_contact,buyer_phone,agency_name,agency_addr,agency_contact,agency_phone
281,豫财招标采购-2022-606,2022年08月23日,http://hngp.gov.cn/henan/content?infoId=1229545&channelCode=H600102,"1,2,3,4,5",5,,"河南东孚电子科技有限公司,河南摩课教育科技有限公司,郑州简意科技有限公司,河南优浩教育科技有限公司,河南良辰文化传播有限公司","郑州市中原区桐柏南路万福花园24号楼2单元附23号,郑州市金水区文博东路4号院宇泰文博公寓1号楼1单元15楼1501号,郑州市二七区大学南路东鼎盛大道南二七绿地中心三区2号楼314,河南自贸试验区郑州片区(经开)第六大街124号4层18号,河南省郑州市金水区东风路东18号东1单元5层502号","包1：中药学专业（群）教学资源库,包2：信息安全技术应用专业（群）教学资源库,包3：铁道信号自动控制专业（群）教学资源库,包4：城市轨道交通运营管理专业（群）教学资源库,包5：钢琴调律专业（群）教学资源库","1779000.00,566000.00,985000.00,779000.00,269040.00",,郑州铁路职业技术学院,郑州市郑东新区前程路9号,王老师,0371-60867917,河南安创工程招标管理有限公司,河南省国家大学科技园东区15号楼J座2楼,郭欣荣,0371-86235366邮箱：hnacgczb@163.com
282,豫财招标采购-2022-799,2022年08月24日,http://hngp.gov.cn/henan/content?infoId=1230147&channelCode=H600102,"1,2,3",3,,"郑州华久科技有限公司,河南钧志信息技术有限公司,河南福斯泰数字科技有限公司","河南省郑州市高新技术产业开发区翠竹街 76 号 11 号楼 1 单元 14 层 1401 号,河南省郑州市金水区农业路 67 号院附 5 号 2 号楼 2 单元 2 层 24 号,河南省南阳市卧龙区梅溪街道建设中路 967 号新经济产业园 2 楼 208 室","南阳师范学院综合楼及博睿楼智慧教室建设项目,南阳师范学院综合楼及博睿楼智慧教室建设项目,南阳师范学院综合楼及博睿楼智慧教室建设项目","1409800.00,1398800.00,1229800.00",,南阳师范学院,南阳市卧龙区卧龙路1638号,张老师,0377-63513796,中益工程管理有限公司,南阳市第二技工学校院内,金鑫,18637777536
283,郑财招标采购-2022-122,2022年08月24日,http://hngp.gov.cn/henan/content?infoId=1228389&channelCode=H610102,1,1,,河南晨鸟电子科技有限公司,河南省郑州市高新技术开发区翠竹街76号9号楼1单元13层1315号,郑州旅游职业学院跨境电商产教融合实训基地项目,1279720,,郑州旅游职业学院,河南省郑州市郑东新区金龙路188号,武衡,0371-61130307,郑州市公共资源交易中心,郑州市中原西路郑发大厦7018室,卢浩,0371-67110139
284,豫财招标采购-2022-745,2022年08月18日,http://hngp.gov.cn/henan/content?infoId=1227763&channelCode=H600102,1,1,,安阳江川实业有限公司,河南省安阳市北关区彰德路5号悠乐生活广场1号楼20层2029号,液晶高清激光投影机,3130100,,安阳师范学院,河南省安阳市弦歌大道,贺老师,0372-3300550,河南豫信招标有限责任公司,郑州市郑东新区商务外环西七街中华大厦19层,王娟、任飞,0371-22307212
285,洛采公开-2022-149,2022年08月23日,http://hngp.gov.cn/henan/content?infoId=1226947&channelCode=H640102,1,1,,河南杰文信息技术有限公司,郑州经济技术开发区航海东路第六大街商鼎创业大厦526、527室,洛阳职业技术学院省级老服专业资源库建设项目,558000,,洛阳职业技术学院,洛阳市伊滨区科技大道6号,刘老师,0379-62305860,中金泰富工程管理有限公司,郑州市经七路与红专路交叉口向北200米路东中亨大厦七楼713室,周女士,0379-60163578
286,舞采公开采购-2022-9,2022年08月23日,http://hngp.gov.cn/henan/content?infoId=1227095&channelCode=H720202,"1,2,3",3,,"漯河存星商贸有限公司,舞阳县润云商贸有限公司,河南省超之恒建设工程有限责任公司","河南省漯河市源汇区湘江路与泰山路交叉口家盛世国际生活馆二楼E区,河南省漯河市舞阳县舞泉镇宁波路检察院对面69号,河南省安阳市林州市建筑总部大厦E006","采购办公家具一批,采购空调机一批,采购触控一体机17台","1564442.74,340880.00,554880.00",,舞阳县第一高级中学,漯河市舞阳县人民路西段,陈志锋,13803957321,舞阳县政府采购中心,舞阳县北京路,郭女士,0395-7122601
287,郑财招标采购-2022-166,2022年08月22日,http://hngp.gov.cn/henan/content?infoId=1225661&channelCode=H610102,1,1,,郑州睿贤教学设备有限公司,郑州市金水区索凌路 11 号院 7 号楼 2 单元 6 层602 号,郑州市第五十六高级中学（郑州市郑开示范高级中学）2022年物理实验室设备项目采购,998800,,郑州市第五十六高级中学（郑州市郑开示范高级中学）,郑州市中牟县沐春路以北，筑梦街以东，沐雨路以南,潘志敏,0371-67984259,河南省中安民诚工程咨询有限公司,郑州市陇海西路55号院郑州市劳动大厦院内二楼,王新,0371-67177749-8012电子信箱：mczxdlyb@163.com
288,郑财招标采购-2022-126,2022年08月16日,http://hngp.gov.cn/henan/content?infoId=1225565&channelCode=H610102,1,1,,郑州海诺电子科技有限公司,郑州市金水区花园路 85 号 7 层 D 户,详见招标文件,1984520,,郑州师范学院,郑州惠济区英才街6号,肖老师,0371-65501551,河南信则招标管理咨询有限公司,郑州市东风南路创业路绿地之窗景峰座21楼,代逸晖,0371-55632128
289,新安政采公开-2022-46,2022年08月19日,http://hngp.gov.cn/henan/content?infoId=1225476&channelCode=D760502,"1,2,3",3,,"河南亿邦科教设备有限公司,河南创力电子有限公司,上海众茂医疗科技有限公司","河南省郑州市金水区花园路53号3号楼2层202,郑州市金水区东风路东段11号百脑汇大厦504室,中国(上海)自由贸易试验区芳春路400号1幢3层","新安职高教学平台与实训软件建设项目,新安职高教学平台与实训软件建设项目,新安职高教学平台与实训软件建设项目","1296000.00,1383100.00,1399480.00",,新安县职业高级中学,新安县黄河路西段,李先生,13938828811,河南盛地工程管理有限公司,洛阳市西工区芳林南路芳林大厦商务楼11楼1113室,杨女士,0379-63263626
290,郑东公开备[2022]21号,2022年08月18日,http://hngp.gov.cn/henan/content?infoId=1224717&channelCode=D360202,1,1,,河南贝森幼教设备有限公司,郑州市郑东新区站南路西、福禄路南1幢10层8号,大型户外木制玩具,2159890,,郑州市郑东新区龙源第一幼儿园,郑州市金水区龙文路和丰熙街交叉口东北角,汤淑瑞,0371-80961680,河南求实工程造价咨询有限公司,郑州高新区科学大道53号中原广告产业园2号楼九层907室（解放军信息工程大学南门对面）,肖雪白子锐,0371-53360703
291,郑东公开备[2022]23号,2022年08月18日,http://hngp.gov.cn/henan/content?infoId=1224721&channelCode=D360202,1,1,,河南米可教育科技有限公司,河南省郑州市中原区建设西路198号院A座12层3号,原木 6 人 桌,1755986,,郑州市郑东新区象湖第一幼儿园,郑州市中牟县良秀路北50米,秦雪,0371-80961679,河南求实工程造价咨询有限公司,郑州高新区科学大道53号中原广告产业园2号楼九层907室（解放军信息工程大学南门对面）,李田田肖雪,0371-53360703
292,郑东公开备[2022]20号,2022年08月19日,http://hngp.gov.cn/henan/content?infoId=1224719&channelCode=D360202,1,1,,河南美萌哒信息科技有限公司,河南自贸试验区郑州片区（郑东）商务内环路23号楼2单元12层1201号,户外综合体能游乐设施,1956774,,郑州市郑东新区白沙中心幼儿园,郑州市中牟县复兴路122号,周建华,0371-60126916,河南求实工程造价咨询有限公司,郑州高新区科学大道53号中原广告产业园2号楼九层907室（解放军信息工程大学南门对面）,李田田肖雪,0371-53360703
293,郑财招标采购-2022-169,2022年08月19日,http://hngp.gov.cn/henan/content?infoId=1224636&channelCode=H610102,1,1,,郑州硕学电子科技有限公司,河南省郑州市金水区金水路201号院6号楼2407室,郑州市第五十六高级中学（郑州市郑开示范高级中学）2022年生物实验室设备项目采购,1363000,,郑州市第五十六高级中学（郑州市郑开示范高级中学）,郑州市中牟县沐春路以北，筑梦街以东，沐雨路以南,潘志敏,0371-67984259,河南省中安民诚工程咨询有限公司,郑州市陇海西路55号院郑州市劳动大厦院内二楼,王新,0371-67177749-8012电子信箱：mczxdlyb@163.com
294,郑财招标采购-2022-167,2022年08月19日,http://hngp.gov.cn/henan/content?infoId=1224619&channelCode=H610102,1,1,,河南金普教学设备有限公司,河南省郑州市管城回族区新郑路175号1单元5楼西户,郑州市第五十六高级中学（郑州市郑开示范高级中学）2022年化学实验室设备项目采购,1713370,,郑州市第五十六高级中学（郑州市郑开示范高级中学）,郑州市中牟县沐春路以北，筑梦街以东，沐雨路以南,潘志敏,0371-67984259,河南省中安民诚工程咨询有限公司,郑州市陇海西路55号院郑州市劳动大厦院内二楼,王新,0371-67177749-8012电子信箱：mczxdlyb@163.com
295,洛采公开-2022-145,2022年08月18日,http://hngp.gov.cn/henan/content?infoId=1223374&channelCode=H640102,"1,2",2,,"龙祥物业管理有限公司,洛阳佳缘物业管理有限公司","洛阳市洛南新区开元大道 256 号 1905 室,河南省洛阳市洛龙区滨河南路 61 号 1-1 幢 1-1606","洛阳职业技术学院伊滨校区物业外包服务项目,洛阳职业技术学院伊滨校区物业外包服务项目","4856880.00,3069999.00",,洛阳职业技术学院,洛阳市伊滨区科技大道六号,周先生雷先生,0379-62235733,洛阳市政府采购中心,洛阳市洛龙区开元大道与永泰街交叉口西南角洛阳市民之家六楼6013、6014室,王女士崔先生,0379-6992102769921028
296,豫财招标采购-2022-833,2022年08月17日,http://hngp.gov.cn/henan/content?infoId=1224561&channelCode=H600102,1,1,,郑州水土坊结构技术有限公司,郑州经济技术开发区经南三路与第一大街交叉口向西50米博赛生物院内厂房,河南信息统计职业学院白沙校区教学楼功能提升与改造,2181872.75,,河南信息统计职业学院,郑州市郑东新区金龙路与刘集街交叉口,白先生,0371-56858620,中海域安项目管理咨询有限公司,河南省郑州市金水区中州大道1188号置地广场3号楼12层63号,宋女士,0371-85512909-809
297,豫财招标采购-2022-647,2022年08月18日,http://hngp.gov.cn/henan/content?infoId=1224486&channelCode=H600102,"1,2,3,4",4,,"河南精微教育科技有限公司,河南迪思商贸有限公司,河南亿众网络科技有限公司,河南合庆建筑工程有限公司","郑州市金水区紫荆山路8号阳光铭座B座1303号,商丘市梁园区凯旋路与凯四街交叉口西南角中兴小区2号楼西单元501号,商丘市梁园区民主路北侧归德路西侧电子商城A区16号,商丘市睢阳区南京路北归德路东宇鑫国际1号楼2311室","包1,包2,包3,包4","1057680.00,1041630.00,1059360.00,409786.79",,商丘师范学院,河南省商丘市平原中路55号,庞老师,0370-3057682,河南安创工程招标管理有限公司,河南省国家大学科技园东区15号楼J座2楼,郭芬,0371-86235366邮箱：hnacgczb@163.com
298,南阳政采公开-2022-57,2022年08月17日,http://hngp.gov.cn/henan/content?infoId=1221946&channelCode=H740602,1,1,,郑州量子伟业信息技术有限公司,郑州市金水区文化路82号硅谷广场B座8层801号,学生微机室装备,2026900,,南阳市第十五小学校,南阳市七一路174号,陈烨,18637787677,南阳市政府采购中心,南阳市范蠡东路与南都路交叉口市民服务中心中区3号楼5楼,程文博,0377-61176178
299,2022-07-141,2022年08月17日,http://hngp.gov.cn/henan/content?infoId=1221376&channelCode=H650202,1,1,,平顶山市宝玛仕商贸有限公司,河南省平顶山市新华区金石路与 晶珠路交叉口向东50米路北西建材嘉苑商场负一楼135、136号,本项目为河南质量工程职业学院致知楼教室桌椅更换，具体内容详见招标文件。,544292,,河南质量工程职业学院,河南省平顶山市姚电大道中段,马老师,0375-7668752,卓恒工程咨询有限公司,河南省郑州市中原区汝河路82号院1号楼办公楼3楼,李洪涛,0375-707352113140010598
300,豫财招标采购-2022-721,2022年08月15日,http://hngp.gov.cn/henan/content?infoId=1221380&channelCode=H600102,1,1,,河南明昕信息技术有限公司,郑州市高新技术开发区山桃路 11 号恒大翡翠华庭 7 号楼 1 单元 601 号,河南工学院云网络语音室项目,2198000,,河南工学院,河南省新乡市平原路东段699号,张老师,0373-3691035,河南省教育招标服务有限公司,河南省郑州市金水区花园路与农业路交叉口北100米路西河南省农业科学院农信楼一楼,翟向阳姚刚候雷胜,0371-56058512\13\19
301,2022-07-7,2022年08月16日,http://hngp.gov.cn/henan/content?infoId=1220391&channelCode=H740602,"1,2,3,4",4,,"南阳市华卓科技有限公司,河南茂学商贸有限公司,河南翊轩光电科技有限公司,南阳市未来智享信息科技有限公司","河南省南阳市宛城区仲景路与建设路交叉口西北角教育综合楼9楼西南户,河南自贸试验区郑州片区（郑东）金水东路49号绿地原盛国际3号楼A座11层139号,南阳市中关村创新创业园C栋,南阳市宛城区仲景街道孔明南路三串盛唐国际家居广场二楼8号","南阳市第十一完全学校采购设备一批项目,南阳市第十一完全学校采购设备一批项目,南阳市第十一完全学校采购设备一批项目,南阳市第十一完全学校采购设备一批项目","446530.00,936720.00,698600.00,498663.00",,南阳市第十一完全学校,南阳市中州西路,刘先生,13503778766,荣达工程咨询有限公司,南阳市卧龙区七一路706号,宋先生,0377-66965888
302,三财公开采购-2022-43,2022年08月12日,http://hngp.gov.cn/henan/content?infoId=1219561&channelCode=H730202,"1,2",2,,"河南捷之盟电子科技有限公司,河南静芝灵网络科技有限公司","郑州市金水区北三环 59 号锦绣汇城小区七号楼一单元 1004 室,河南省郑州市金水区科技市场电子大厦三楼 A001","试验筛,制图实训桌（学生）45个、图形工作站 45台等设备","1665500.00,747600.00",,三门峡职业技术学院,三门峡市崤山西路42号,周老师,15238927023,三门峡市政府采购服务中心,三门峡市崤山路西段28号（开发区电子城西侧）,葛女士,0398-3117812
303,2022-07-8,2022年08月16日,http://hngp.gov.cn/henan/content?infoId=1220386&channelCode=H740602,"1,2",2,,"河南一二三体育设施有限公司,南阳市华卓科技有限公司","河南省南阳市宛城区滨河路与明山路交叉口237号,河南省南阳市宛城区仲景路与建设路交叉口西北角教育综合楼9楼西南户","采购南阳市第十五完全学校学生双人床一批,采购南阳市第十五完全学校学生课桌凳一批","159390.00,237675.00",,南阳市第十五完全学校,南阳市百里奚路与张衡路交叉口,刘先生,13503778766,荣达工程咨询有限公司,南阳市七一路706号,宋先生,0377-66965888
304,豫财招标采购-2021-1366,2022年08月12日,http://hngp.gov.cn/henan/content?infoId=1218436&channelCode=H600102,1,1,,郑州潜力电子科技有限公司,郑州经济技术开发区航海东路1356号商鼎717房,一包：商丘师范学院文化旅游综合教学实验中心项目设备采购；,2298000,,商丘师范学院,商丘市平原中路55号,庞老师,0370-3057682,中建山河建设管理集团有限公司,郑州市郑东新区七里河南路与圃田西路交叉口西南角明亮环保三楼312室,王女士刘先生,0371-8655616118037790107
305,豫财招标采购-2022-666,2022年08月11日,http://hngp.gov.cn/henan/content?infoId=1218916&channelCode=H600102,"1,2,3",3,,"郑州博安贸易有限公司,郑州德乐圣商贸有限公司,郑州博安贸易有限公司","郑州市金水区郑花路59号21世纪广场4号楼11层1108号,郑州市金水区金水路122号1层,郑州市金水区郑花路59号21世纪广场4号楼11层1108号","详见招标文件,详见招标文件,详见招标文件","447200.00,538000.00,1647890.00",,安阳师范学院,安阳市弦歌大道436号,贺老师,0372-3300550,河南招标采购服务有限公司,郑州市纬四路13号（花园路与纬四路交叉口东50米路北）,张斯栋、李芬,0371-65958908
306,社财采购公开-2022-19,2022年08月10日,http://hngp.gov.cn/henan/content?infoId=1215514&channelCode=H740602,"1,2,3,4,5,6",6,,"河南省芯智联网络科技有限公司,郑州明道网络科技有限公司,河南省玄慧通智能科技有限公司,上海中仪盈创信息科技有限公司,河南继学电子科技有限公司,南阳迈升商贸有限公司","南阳市卧龙区车站路医专一附院7号门面房,河南省郑州市二七区京广路街道二七区碧云路 99 号 42号搂3层303号,河南自贸试验区郑州片区（郑东）商务外环路 23 号中科大厦 22 层 2202 号,上海市宝山区上大路 668 号 1 幢 5 层 B 区,河南省郑州市金水区郑汴路 127 号院 28 层 2808 号,河南省南阳市示范区新店乡下王庄 1 组 1 号","智慧教室建设工程,电子商务实训室,会计专业实训室,新能源汽车实训室,网络搭建实训室,电气控制实训室","592600.00,1027500.00,926292.00,708800.00,835000.00,809900.00",,社旗县中等职业学校,社旗县长江路,赵瑞祥,13598235238,南阳国匠工程咨询有限公司,南阳市独山大道与两相路交叉口西100米路南,邢丹丹,18736675285
307,豫财招标采购-2022-702,2022年08月08日,http://hngp.gov.cn/henan/content?infoId=1215072&channelCode=H600102,1,1,,快云信息科技有限公司,郑州经济技术开发区经北三路通信产业园第一层北侧,详见招标文件,1774840,,河南信息统计职业学院,郑州市郑东新区金龙路与刘集街交叉口,吴老师,0371-65727728,河南正禄招标代理有限公司,河南省郑州市郑东新区白沙镇通惠路31号府苑小区1号楼1单元402号,张华,182371666510371-53301569
308,,,http://hngp.gov.cn/henan/content?infoId=1214083&channelCode=H600104,,0,,,,,,,,,,,,,,
309,郑财招标采购-2022-147,2022年08月09日,http://hngp.gov.cn/henan/content?infoId=1213998&channelCode=H610102,1,1,,河南慧达电子科技有限公司,郑州金水区丰庆路 4 号院 27 号楼 12 层 215 号,郑州市第五十六高级中学（郑州市郑开示范高级中学）2022年学术报告厅和合班教室项目采购,821713,,郑州市第五十六高级中学（郑州市郑开示范高级中学）,郑州市中牟县沐春路以北，筑梦街以东，沐雨路以南,潘志敏,0371-67984259,河南省中安民诚工程咨询有限公司,郑州市陇海西路55号院郑州市劳动大厦院内二楼,王新,0371-67177749-8012电子信箱：mczxdlyb@163.com
310,豫财招标采购-2022-648,2022年08月09日,http://hngp.gov.cn/henan/content?infoId=1213825&channelCode=H600102,1,1,,郑州胜之淘科技有限公司,郑州市金水区徐庄东路97号牛顿国际B座3楼F10区,商丘师范学院物理实验技能实训室建设项目,1608000,,商丘师范学院,商丘市平原中路55号,庞永清,0370-3057682,河南省机电设备招标股份有限公司,郑州市郑东新区CBD商务外环路23号中科金座大厦8楼814室,尹贝贝,0371-65928019
311,,,http://hngp.gov.cn/henan/content?infoId=1214133&channelCode=H720204,,0,,,,,,,,,,,,,,
312,豫财招标采购-2022-49,2022年08月09日,http://hngp.gov.cn/henan/content?infoId=1213837&channelCode=H600102,1,1,,河南简捷教育科技有限公司,河南省郑州市金水区经三路66号金成国际广场B座1805室,河南中医药大学多媒体教室智慧化建设项目,4269600,,河南中医药大学,河南省郑州市郑东新区金水路156号,苏老师,0371－65680556,郑州大学建设科技集团有限公司,郑州大学建设科技集团4楼401室(郑州市金水区丰产路与东三街交叉口东南角),陈女士、张女士,18638509519、17513130624
313,浚财招标采购-2022-25,2022年08月09日,http://hngp.gov.cn/henan/content?infoId=1214113&channelCode=H670202,1,1,,河南一早教学设备有限公司,郑州市中原区陇海路桐柏路升龙金中环4号楼30层3008-3009室,浚县第三高级中学综合楼维修改造项目（设备采购）,789000,,浚县第三高级中学,浚县城西三公里路北,郭林堂,13939249408,华新项目管理集团有限公司,浚县黄河路与建设路交叉口北200米路东口子窖超市3楼,李星,18803920548
314,郑财招标采购-2022-150,2022年08月10日,http://hngp.gov.cn/henan/content?infoId=1214299&channelCode=H610102,1,1,,郑州索特信息技术有限公司,郑州市金水区花园路39号3号楼1单元21层2107号,郑州市第五十六高级中学（郑州市郑开示范高级中学）2022年智慧校园应用平台项目采购,1625000,,郑州市第五十六高级中学（郑州市郑开示范高级中学）,郑州市中牟县沐春路以北，筑梦街以东，沐雨路以南,潘志敏,0371-67984259,河南省中安民诚工程咨询有限公司,郑州市陇海西路55号院郑州市劳动大厦院内二楼,王新,0371-67177749-8012电子信箱：mczxdlyb@163.com
315,,,http://hngp.gov.cn/henan/content?infoId=1212190&channelCode=H660204,,0,,,,,,,,,,,,,,
316,新乡政采招标采购-2022-144,2022年07月26日,http://hngp.gov.cn/henan/content?infoId=1212888&channelCode=H680202,1,1,,河南锦美建设工程有限公司,河南省新乡市市辖区启明三巷月11号,新乡职业技术学院教室粉刷项目,1850036.95,,新乡职业技术学院,河南省新乡市经济技术开发区经三路六号,张志平,13782507170,河南招标采购服务有限公司,郑州市金水区纬四路13号,王现锋,0373-6378465、15736917378
317,,,http://hngp.gov.cn/henan/content?infoId=1210521&channelCode=H601401,,0,,,,,,,,,,,,,,
318,2022-07-45,2022年08月04日,http://hngp.gov.cn/henan/content?infoId=1209896&channelCode=D690503,"1,2",2,,"湖南利智科技有限公司,河南新华天恒智业装备有限责任公司","长沙高新开发区岳麓西大道 588 号芯城科技园 1 栋 804 房,郑州市郑东新区商都路 350 号","洛阳市孟津区第一高级中学新区高中教育教学设备采购项目（第一批）第六标段,","3255300.00,2479040.00",,洛阳市孟津区第一高级中学,河南省洛阳市孟津区城关镇会盟大道,郭老师,0379-67918699,西安瑞君建设项目管理有限公司,中国（河南）自由贸易试验区洛阳片区（高新）木棉路19号北航科技园4号楼1404室,张先生,0379-69969988
319,2022-07-45,2022年08月03日,http://hngp.gov.cn/henan/content?infoId=1209895&channelCode=D690503,"1,2,3,4",4,,"洛阳市华辰办公家具有限公司,洛阳市九都金柜有限公司,洛阳卓宏办公家具有限公司,河南省硕辉家具有限公司","洛阳市伊滨区寇店镇李家村,洛阳市伊滨区庞村镇窑沟村三组,洛阳市伊滨区庞村镇大庄村 5 组,洛阳市伊滨区李村镇石罢村15 组","孟津区第一高级中学新区高中108个教室采购课桌凳4740套。,,,孟津区第一高级中学新区高中采购办公桌椅572套。","786840.00,4311360.00,928140.00,799656.00",,洛阳市孟津区第一高级中学,河南省洛阳市孟津区城关镇会盟大道,郭老师,0379-67918699,西安瑞君建设项目管理有限公司,中国（河南）自由贸易试验区洛阳片区（高新）木棉路19号北航科技园4号楼1404室,张先生,0379-69969988
320,,,http://hngp.gov.cn/henan/content?infoId=1209686&channelCode=H740604,,0,,,,,,,,,,,,,,
321,焦采招标采购-2022-28,2022年08月04日,http://hngp.gov.cn/henan/content?infoId=1209349&channelCode=H690202,1,1,,河南天玥信息技术有限公司,河南自贸试验区郑州片区（郑东）金水东路21号永和国际广场B座1308室,建设实训室智能管理中心,3497600,,焦作师范高等专科学校,焦作师范高等专科学校新校区（山阳区山阳路988号）,滑先生,15639192186,焦作市公共资源交易中心,焦作市人民路889号阳光大厦B座,岳先生,0391-3568815
322,郑财招标采购-2022-106,2022年07月26日,http://hngp.gov.cn/henan/content?infoId=1208904&channelCode=H610102,1,1,,河南盛世航空服务有限责任公司,河南省郑州市金水区东风路142号瀚海海尚C座2320,完成本项目所有设备、材料、安装、调试验收等相关内容,11952781.75,,郑州财税金融职业学院,河南省郑州市郑尉路18号,海啸,0371-66880437,方大国际工程咨询股份有限公司,郑州市郑东新区康宁街与普济路交汇处德威广场12F,李杭原、岳洋洋,0371-85967760
323,郑财招标采购-2022-138,2022年08月03日,http://hngp.gov.cn/henan/content?infoId=1208303&channelCode=H610102,1,1,,郑州鑫诺汽车服务有限公司,郑州市金水区茂花路6号院7号楼1楼商铺,新能源汽车实训基地建设,3146885,,郑州市金融学校,郑州市建设路伏牛路交叉口,张家峰,0371-56702861,河南省伟信招标管理咨询有限公司,郑州市郑东新区东风南路与创业路交叉口绿地中心北塔16楼,李金秋董辛鹏,0371-65528292
