,project_id,winning_date,winning_notice_url,order_id,winning_order_cnt,project_winning_amt,supplier_name,supplier_addr,order_name,winning_amt,cadidate_name,buyer_name,buyer_addr,buyer_contact,buyer_phone,agency_name,agency_addr,agency_contact,agency_phone
0,郑财招标采购-2022-347,2023年01月11日,http://hngp.gov.cn/henan/content?infoId=1340382&channelCode=H610102,1,1,,河南云鲸信息技术有限公司,郑州高新技术产业开发区西三环289号创新园13号楼9层901室,郑州旅游职业学院智慧校园管理服务提升项目,2208000,,郑州旅游职业学院,河南省郑州市郑东新区金龙路188号,姬老师,0371-61130116,河南广电招标有限公司,郑州市金水区经五路2号,唐先生,0371-65887848
1,郑财招标采购-2022-355,2022年12月29日,http://hngp.gov.cn/henan/content?infoId=1333930&channelCode=H610102,1,1,,河南云鲸信息技术有限公司,郑州高新技术产业开发区西三环289号创新园13号楼9层901室,智慧校园数据治理，详见招标文件。,2138000,,郑州旅游职业学院,郑州市郑东新区金龙路188号,姬晖,0371-61130116,河南省通力建设工程咨询有限公司,郑州市经开区航海东路与经开第八大街交叉口富田财富广场1号楼22层2202室,张硕,17320106752
2,豫财招标采购-2022-789,2022年12月27日,http://hngp.gov.cn/henan/content?infoId=1333871&channelCode=H600102,1,1,,北京智慧远景科技产业股份有限公司,北京市西城区新街口外大街28号A座231号,安阳师范学院智慧校园能源管理平台项目2,1180000,,安阳师范学院,河南省安阳市弦歌大道安阳师范学院,贺老师,0372-3300550,河南省教育招标服务有限公司,河南省郑州市金水区花园路与农业路交叉口北100米路西河南省农业科学院农信楼一楼,翟向阳侯雷胜姚刚,0371-56058512\13\19
3,郑财招标采购-2022-343,2022年12月28日,http://hngp.gov.cn/henan/content?infoId=1332423&channelCode=H610102,"1,2",2,,"河南晟智科技有限公司,成都市灵奇空间软件有限公司","郑州市金水区农业路东16号2号楼2309号,成都市武侯区旅游村4-2幢3号2层","三维可视化智慧校园管理平台开发,地图数据制作","3632860.00,116800.00",,郑州旅游职业学院,郑州市郑东新区金龙路188号,姬晖,0371-61130016,河南招标采购服务有限公司,郑州市纬四路13号（花园路与纬四路交叉口东50米路北）,袁野,0371-65945493
4,南阳政采公开-2022-142,2022年12月22日,http://hngp.gov.cn/henan/content?infoId=1327837&channelCode=H740602,1,1,,中国移动通信集团河南有限公司南阳分公司,南阳市张衡东路 1266 号,南阳市实验中学智慧校园建设（一期）项目,2180000,,南阳市实验中学,南阳市进贤街36号,张老师,18595995717,中基建安工程管理有限公司,河南自贸试验区郑州片区（郑东）心怡路319号易元国际B座1624号,任先生,19137921721
5,豫财招标采购-2022-1095,2022年12月08日,http://hngp.gov.cn/henan/content?infoId=1316535&channelCode=H600102,"1,2",2,,"河南云鲸信息技术有限公司,精华教育科技股份有限公司","郑州高新技术产业开发区西三环289号创新园13号楼9层901室,郑州市金水区文化路82号硅谷广场2号楼8层805号","安阳师范学院智慧校园基础平台包一,安阳师范学院智慧校园基础平台包二","5666000.00,2050000.00",,安阳师范学院,安阳市弦歌大道436号,贺老师,0372-3300550,河南招标采购服务有限公司,郑州市金水区纬四路13号,张斯栋、李芬,0371-65958908
6,洛采公开-2022-232,2022年12月09日,http://hngp.gov.cn/henan/content?infoId=1315898&channelCode=H640102,1,1,,北京希嘉创智教育科技有限公司,北京市朝阳区酒仙桥东路18号1号楼五层B506,洛阳职业技术学院智慧校园数据治理与共享交换服务平台项目,1786500,,洛阳职业技术学院,洛阳市伊滨区科技大道6号,柴老师,13525932339,河北恒基建设招标有限公司,洛阳市洛龙区金城寨街与展览路交叉口西北角一品雅居2号楼1单元2201,雷女士,0379-65996079
7,豫财招标采购-2022-1177,2022年12月06日,http://hngp.gov.cn/henan/content?infoId=1313152&channelCode=H600102,1,1,,河南河源计算机科技有限公司,郑州市金水区东风路东段11号9层911号,具体详见招标文件,2488000,,河南省商务中等职业学校,郑州市金水区博颂路6号,杨老师,0371-63795361,中诚景信工程咨询有限公司,郑州市郑东新区康宁街与心怡路交叉口亚新广场A座8楼805室,邵先生、侯女士,0371-87520763
8,豫财招标采购-2022-1241,2022年12月02日,http://hngp.gov.cn/henan/content?infoId=1312273&channelCode=H600102,1,1,,河南省哲浩电子技术有限公司,郑州市金水区信息学院路8号院3号楼1单元5层9号,河南师范大学2022年中央财政智慧教学环境建设(一期)项目,4773914,,河南师范大学,河南省新乡市建设东路46号,王老师,0373-3326357,河南省公共资源交易中心,郑州市经二路12号,唐老师申老师,0371-65915561hnggzyzfcg1@126.com
9,豫财招标采购-2022-1206,2022年11月23日,http://hngp.gov.cn/henan/content?infoId=1303261&channelCode=H600102,1,1,,郑州迈达信息技术有限公司,郑州高新技术产业开发区冬青街26号河南省电子商务产业园6号楼1202-36号,河南工业贸易职业学院双向互动视频教学系统设施建设项目,4739260,,河南工业贸易职业学院,河南省郑州市新郑龙湖大学城祥云路,靳老师,0371-60987880,河南省机电设备国际招标有限公司,郑州市管城区商都路27号财信大厦15楼,高志勇、延丽丽、王楠楠,0371-86096556
10,驻政采购-2022-10-22,2022年11月23日,http://hngp.gov.cn/henan/content?infoId=1303153&channelCode=H780602,1,1,,中国联合网络通信有限公司驻马店市分公司,驻马店北开发区团结路西段,关于改善办学条件、提升教学质量项目（第四期）,7695575,,驻马店幼儿师范高等专科学校,驻马店市驿城区盘龙山路2658号铜山大道与纬十路交叉口,史先生,0396-3580288,河南铭鸿招标代理服务有限公司,驻马店市驿城区雪松路与塘坊路交叉口塘坊庄社区陈庄安置大厦204,刘女士,15660506658
11,三财公开采购-2022-49,2022年11月02日,http://hngp.gov.cn/henan/content?infoId=1289543&channelCode=H730202,1,1,,河南仪迈科技有限公司,河南省郑州市惠济区南阳路 185 号裕华文汇 6 号楼 2 单元 601 号,智能滑动轴承实验系统,1466800,,三门峡职业技术学院,三门峡市崤山路西段42号,周老师,13633986917,三门峡市政府采购服务中心,三门峡市崤山路西段28号（开发区电子城西侧）,黄女士,0398-3117873
12,浚财磋商采购-2022-70,,http://hngp.gov.cn/henan/content?infoId=1289901&channelCode=H670202,1,1,,河南瑞创思科电子科技有限公司,浚县城镇黄河路南段路西（益民面业北邻50米）,详见附件,599400,,河南省浚县第一中学,河南省浚县城关镇黄河路48号,李保伟,15539285566,华新项目管理集团有限公司,浚县黄河路与建设路交叉口北200米路东口子窖超市3楼,李星,18803920548
13,鹤财招标采购-2022-50,2022年11月01日,http://hngp.gov.cn/henan/content?infoId=1288563&channelCode=H670202,1,1,,武汉泰乐奇信息科技有限公司,武汉市东湖新技术开发区软件园中路4号光谷软件园六期3栋3层01室,模型(详见第三章采购需求),1923600,,鹤壁职业技术学院,鹤壁市淇滨区朝歌路5号,王老师,0392-3330510,河南中鑫恒盛工程管理有限公司,郑州高新技术产业开发区长椿路东冬青街北6幢905号,邵女士,18839256777
14,洛采公开-2022-220,2022年11月01日,http://hngp.gov.cn/henan/content?infoId=1288332&channelCode=H640102,1,1,,河南国凌教育科技有限公司,河南省郑州市二七区陇海中路81号富田陇海花园1号楼东1单元40号,洛阳职业技术学院汽车整车故障诊断技术实训中心项目,966500,,洛阳职业技术学院,河南省洛阳市洛龙区伊滨区科技大道6号,周先生,15896656321,万安建设发展河南有限公司,洛阳市洛龙区经五路与洛宜路交叉口东宇大厦28楼,康女士,0379-69899369
15,濮财市直招标采购-2022-45,2022年10月31日,http://hngp.gov.cn/henan/content?infoId=1287957&channelCode=H700202,1,1,,中电信数智科技有限公司河南分公司,郑州市金水区宝瑞路 115 号河南省信息安全产业示范基地 12 号楼 01 号 1-5 层,详见招标文件,3489000,,濮阳医学高等专科学校,濮阳市华龙区卫都大街与文岩街交叉口,娄长琳,16650527775,河南四方建设管理有限公司,郑州经济技术开发区航海东路1394号1幢15层,崔国帅,18538256639
16,清采公开-2022-33,2022年10月31日,http://hngp.gov.cn/henan/content?infoId=1287539&channelCode=E000503,1,1,,濮阳市濮大商贸有限公司,河南省濮阳市市辖区濮阳市黄河路与濮上路交叉口北200路东,清丰县春晖路小学教学办公设备购置,988600,,清丰县春晖路小学,清丰县城关镇春晖路西侧文化路南侧,贾敬培,13839337333,濮阳市清丰县政府采购中心,清丰县人民路政府综合楼东南角二楼,张团杰,0393-7219107
17,2022-08-23,2022年10月18日,http://hngp.gov.cn/henan/content?infoId=1278970&channelCode=H680202,1,1,,河南金天丽科教设备有限公司,河南省濮阳市清丰县产业集聚区,具体详见采购文件（第五部分 招标项目采购需求）,900000,,原阳县第五初级中学,原阳县城区人民路东段路南,赵高丽,13938700234,河南恒创工程咨询有限公司,新乡市红旗区金穗大道与新中大道交叉口西北角新闻大厦,李嘉曼,13137327722
18,南阳政采公开-2022-93,2022年10月19日,http://hngp.gov.cn/henan/content?infoId=1279699&channelCode=H740602,1,1,,河南祥泰教学设备有限公司,郑州市金水区徐庄东路97号牛顿国际B座3楼C03区,文化路校区物理实验室装备项目,1003600,,南阳市第十三中学校,南阳市文化路,王盛林,18737705050,南阳信威招标代理有限公司,南阳市梅溪路209号,肖金保,15936418708
19,南召政采公开-2022-26,2022年10月17日,http://hngp.gov.cn/henan/content?infoId=1277388&channelCode=H740602,"1,2,3,4,5",5,,"河南飞嘉实业有限公司,河南东晶医疗科技有限公司,河南昊泽康医疗器械有限公司,河南东晶医疗科技有限公司,河南诚嘉信息技术有限公司","河南省南阳市高新区中关村科技产业园商苑街112号(经十路与商苑街交叉口向西200米路南）,河南省开封市兰考县产业集聚区济阳大道与科技路恒大产业园办公楼2楼总部经济港2-1-11,南阳市中州西路摩托车配件批发市场,河南省开封市兰考县产业集聚区济阳大道与科技路恒大产业园办公楼2楼总部经济港2-1-11,河南省郑州市金水区朝阳路2号院2号楼1单元6层11号","河南省南召卫生职业中等专业学校附属医院提升改造医疗设备采购项目第1标段,河南省南召卫生职业中等专业学校附属医院提升改造医疗设备采购项目第2标段,河南省南召卫生职业中等专业学校附属医院提升改造医疗设备采购项目第3标段,河南省南召卫生职业中等专业学校附属医院提升改造医疗设备采购项目第4标段,河南省南召卫生职业中等专业学校附属医院提升改造医疗设备采购项目第5标段","1744100.00,3645180.00,3534683.00,798900.00,1078000.00",,河南省南召卫生职业中等专业学校,南召县城关镇黄鸭河桥东,杨菊,18538978787,中豫建设工程咨询有限公司,河南省郑州市高新技术产业开发区西三环路283号国家大学科技园东区17号楼-4号,杨女士,0371-61773033，15225093651
20,豫财招标采购-2022-1067,2022年10月12日,http://hngp.gov.cn/henan/content?infoId=1276883&channelCode=H600102,"1,2",2,,"河南康之祥信息科技有限公司,郑州国之安电子科技有限公司","郑州市金水区郑花路59号24号楼西2单元2层西户,郑州市金水区花园路8号安华大厦12层1201号","整车检测一体化实训中心2,汽车车身电气实训中心2","1796000.00,499500.00",,河南省驻马店财经学校,驻马店市盘龙山北路2626号,代国涛,18539669311,郑州众诚建设咨询有限公司,郑州市金水区经八路14号附19号汇元大厦409至419室,赵怀轩,15503962908
21,豫财招标采购-2022-1068,2022年10月13日,http://hngp.gov.cn/henan/content?infoId=1277888&channelCode=H600102,"1,2",2,,"驻马店市德浩商贸有限公司,河南省新亨凯电子产品有限公司","河南省驻马店市泰山路与盘龙山路交叉口西北侧西班牙小镇商住小区,驻马店市浙江国际商城义务小商品市场东区2层2187号","详见招标文件采购需求,详见招标文件采购需求","1067100.00,488500.00",,河南省驻马店财经学校,河南省驻马店市盘龙山路2626号,代老师,0396--2814081,中伟诚工程管理有限公司,河南自贸试验区郑州片区（郑东）普惠路80号1单元22层2218号,张先生,17339681335
22,郑财招标采购-2022-256,2022年10月14日,http://hngp.gov.cn/henan/content?infoId=1276264&channelCode=H610102,1,1,,河南智海电子技术有限公司,新乡市红旗区新延路与丰华街交叉口西南角161号蓝郡国际17号楼1603室（107以西）,郑州旅游职业学院市场营销数字可视化云实训中心项目,1292000,,郑州旅游职业学院,河南省郑州市郑东新区金龙路188号,武衡,0371-61130307,郑州市公共资源交易中心,郑州市中原西路郑发大厦7018室,无,无
23,郑财招标采购-2022-225,2022年10月13日,http://hngp.gov.cn/henan/content?infoId=1275928&channelCode=H610102,1,1,,郑州捷安高科股份有限公司,郑州高新技术产业开发区科学大道133号11层,郑州市科技工业学校-城市轨道交通运营管理仿真实训项目,1686600,,郑州市科技工业学校,郑州市金水区丰乐路123号,张巧英,15038238961,河南省伟信招标管理咨询有限公司,郑州市郑东新区东风南路与创业路交叉口绿地中心北塔16楼,肖军伟,0371-65837988
24,洛采公开-2022-171,2022年10月14日,http://hngp.gov.cn/henan/content?infoId=1275877&channelCode=H640102,1,1,,洛阳浪合科技有限公司,河南省洛阳市中电光谷产业发展加速中心1-1栋201室,信创服务器I,1866500,,洛阳职业技术学院,洛阳市伊滨区科技大道6号,李先生,0379-67256506,洛阳市政府采购中心,洛阳市洛龙区开元大道与永泰街交叉口西南角洛阳市民之家六楼6013、6014室,张先生许先生,0379-69921027
25,豫财招标采购-2022-986,2022年09月27日,http://hngp.gov.cn/henan/content?infoId=1274957&channelCode=H600102,1,1,,郑州敏勤科技有限公司,河南省郑州市郑东新区金水东路136号华北水利水电大学龙子湖校区S6号楼204室,许昌学院数字化实践教学中心（二期）项目,1890800,,许昌学院,许昌市魏都区八一路88号,杨老师,0374-2968716,河南省公共资源交易中心,郑州市经二路12号,王老师,0371-65915565
26,洛采公开-2022-162,2022年10月11日,http://hngp.gov.cn/henan/content?infoId=1272821&channelCode=H640102,1,1,,洛阳市皓联信息科技有限公司,中国(河南)自由贸易试验区洛阳片区高新丰华路6号银昆科技园5#楼301,一标段：智慧教室,889560,,洛阳职业技术学院,洛阳市伊滨区科技大道6号,史先生,0379-62233835,洛阳市政府采购中心,洛阳市洛龙区开元大道与永泰街交叉口西南角洛阳市民之家六楼6013、6014,许先生王先生,0379-69921028
27,郑财招标采购-2022-266,2022年10月10日,http://hngp.gov.cn/henan/content?infoId=1271833&channelCode=H610102,1,1,,河南宸朵商贸有限公司,郑州市二七区嵩山北路93号6号楼4楼西户,郑州市科技工业学校-机器人实训室建设项目,1751800,,郑州市科技工业学校,郑州市金水区丰乐路123号,罗素保,0371-67021486,河南省伟信招标管理咨询有限公司,郑州市郑东新区东风南路与创业路交叉口绿地中心北塔16楼,肖军伟,0371-65837988
28,清采公开-2022-32,2022年10月10日,http://hngp.gov.cn/henan/content?infoId=1271141&channelCode=E000503,1,1,,河南云安智能设备有限公司,濮阳市开州路南段,教学一体机及办公电脑,988900,,清丰县晓月路小学,清丰县城关镇江渎路与和义路交叉口,任中杰,13243208969,濮阳市清丰县政府采购中心,清丰县人民路政府综合楼东南角二楼,张团杰,0393-7219107
29,焦采招标采购-2022-39,2022年09月27日,http://hngp.gov.cn/henan/content?infoId=1262323&channelCode=H690202,1,1,,河南省居泰隆装饰工程有限公司,焦作市山阳区工业路2813号,焦作师范高等专科学校电子商务实训中心改造项目（一包）（二次）,387241.5,,焦作师范高等专科学校,焦作市山阳路998号,李老师,13633911978,汇龙工程咨询有限公司,焦作市解放区新园西路璟都苑7-1号临街门面房,路女士,15837131275
30,豫财招标采购-2022-997,2022年09月22日,http://hngp.gov.cn/henan/content?infoId=1259199&channelCode=H600102,1,1,,郑州博鹏科技有限公司,郑州市中原区桐柏路238号1号楼21层2103号,见招标文件第五章货物需求及技术参数,1963300,,河南工业大学,郑州市高新技术开发区莲花街100号,王老师,0371-67758908,河南诚信工程管理有限公司,郑州市郑东新区商鼎路56号东方陆港C栋14层,刘女士,0371-53307955
31,,,http://hngp.gov.cn/henan/content?infoId=1259145&channelCode=H740604,,0,,,,,,,,,,,,,,
32,豫财招标采购-2022-937,2022年09月21日,http://hngp.gov.cn/henan/content?infoId=1256413&channelCode=H600102,1,1,,河南国鸿实业股份有限公司,郑州市金水区东明路北219号院4号楼2单元1层15号,郑州信息科技职业学院智能工厂虚拟实训中心项目,2750200,,郑州信息科技职业学院,郑州市金水区龙子湖北路36号,任老师,0371-58525590,河南省教育招标服务有限公司,河南省郑州市金水区花园路116号河南省农业科学院院内西南角原农信楼,陈奇、王姝倩,15225164375
33,驻政采购-2022-08-8,2022年09月21日,http://hngp.gov.cn/henan/content?infoId=1258055&channelCode=H780602,1,1,,驻马店市创纪文化传媒有限公司,河南省驻马店市驿城区雪松路与骏马路交叉口东南角燃料公司家属院3号楼2单元501,驻马店市第二初级中学北区功能教室设备采购,4451073,,驻马店市第二初级中学,驻马店市开发区乐山路北段驻马店市二中北校区,皮老师,0396-2758969,中信诚项目管理有限公司,驻马店市置地华庭B座,杨女士,18137647844
34,管招采（2022）55号,2022年09月21日,http://hngp.gov.cn/henan/content?infoId=1255856&channelCode=D280202,1,1,,中云通建电子科技有限公司,河南省郑州市金水区东风路街道文化路82号院附二号1-2附3号,郑州市管城回族区回民第一小学管城回族区教育局所属部分学校录播教室项目,903700,,郑州市管城回族区回民第一小学,郑州市管城回族区营门街23号,冉老师,0371-66226826,汇衡昊远项目管理咨询有限公司,郑州市金水东路49号绿地原盛国际1号楼B座10楼149号,赵小月,15838301538
35,2022-06-52,2022年09月19日,http://hngp.gov.cn/henan/content?infoId=1253482&channelCode=H650202,1,1,,北京易普拉格科技股份有限公司,北京市海淀区西三旗昌临801号27号201,科研管理系统建设,746600,,平顶山学院,平顶山市新华区未来路南段,李卫强,15836993009,河南省机电设备国际招标有限公司,郑州市东明路187号金成大厦B座10楼105室,宋宇,0371-8607919213044791666
36,郑财招标采购-2022-170,2022年09月14日,http://hngp.gov.cn/henan/content?infoId=1248706&channelCode=H610102,1,1,,未来知名（北京）教育科技有限公司,北京市海淀区大柳树路富海中心 3 号楼 1 层 101-3,郑州市第五十六高级中学（郑州市郑开示范高级中学）2022年人工智能实验室项目采购,1360000,,郑州市第五十六高级中学（郑州市郑开示范高级中学）,郑州市中牟县沐春路以北，筑梦街以东，沐雨路以南,潘志敏,0371-67984259,河南省中安民诚工程咨询有限公司,郑州市陇海西路55号院郑州市劳动大厦院内二楼,王新,0371-67177749-8012电子信箱：mczxdlyb@163.com
37,南阳政采公开-2022-13,2022年09月14日,http://hngp.gov.cn/henan/content?infoId=1248410&channelCode=H740602,1,1,,南阳市慧通商贸有限公司,南阳市七一路 78 号,南阳理工学院2021年智慧教室建设项目（三次）,1685880,,南阳理工学院,南阳市长江路80号,祁腾涛,13525120012,诚安工程管理有限公司,南阳市长江路与泰山路交叉口,王丽君,15660972893
38,豫财招标采购-2022-715,2022年09月09日,http://hngp.gov.cn/henan/content?infoId=1247582&channelCode=H600102,1,1,,祥晟科技有限公司,郑州航空港区郑港六路北侧8号2号楼1单元814室,河南财政金融学院校园网络安全提升项目,2898676,,河南财政金融学院,郑州市郑东新区龙子湖北路22号,张老师,0371-61625168,河南中旭国际招标有限公司,郑州市郑东新区商务外环路29号9层0909号,任女士,0371-65862097
39,豫财招标采购-2022-838,2022年09月08日,http://hngp.gov.cn/henan/content?infoId=1247252&channelCode=H600102,"1,2,3,4,5,6,7,8",8,,"国机工业互联网研究院（河南）有限公司,河南拓维尔科技有限公司,河南一真信息科技有限公司,河南函雨奇典电子科技有限公司,中创建达（广东）数据科技有限责任公司,河南嵩铭智能科技有限公司,睿通（天津）智能科技有限公司,河南恒茂创远科技股份有限公司","郑州高新技术产业开发区雪兰路60号1号楼5-6层,河南省郑州市二七区丹枫路6号院1单元14层1407号,河南自贸试验区郑州片区（郑东）商务外环与商务东三街交叉口景峰国际1810,郑州高新技术产业开发区西三环路289号7号楼9层19号,广州市番禺区石壁街石山大道南捷诚街12号2座410（仅限办公用途）,河南省郑州市管城回族区中州大道1899号28号楼8层31号,天津自贸试验区（东疆保税港区）亚洲路6975号金融贸易中心南区1-1-1418,郑州经济技术开发区郑尉路16号5幢1单元1102号","一包段：全过程咨询服务项目,二包段：产品设计仿真中心建设项目,三包段：工艺流程仿真中心交互式一体机项目,四包段：工艺流程仿真中心资源项目,五包段：维保安全仿真中心建设项目,六包段：虚拟仿真体验中心项目,七包段：虚拟仿真研创中心项目,八包段：虚拟仿真实训教学管理及资源共享平台项目","486000.00,2980300.00,1981500.00,1782950.00,1286770.55,2178000.00,1977200.00,2173600.00",,河南职业技术学院,河南省郑州市郑东新区平安大道210号,范科技,0371-69309268,河南兴达工程咨询有限公司,郑州市电厂路与泾河路向西200米路南河南省国家大学科技园东区15号楼F座,李静、张凯,0371-66681093
40,,,http://hngp.gov.cn/henan/content?infoId=1244983&channelCode=H680204,,0,,,,,,,,,,,,,,
41,郑财招标采购-2022-194,2022年09月09日,http://hngp.gov.cn/henan/content?infoId=1244862&channelCode=H610102,1,1,,河南求展实业有限公司,郑州市金水区北环路61号院锦绣汇城5号楼2单元4-5层402号,郑州市第一〇七高级中学开办费-计算机教室云桌面终端（224点位）项目,2148340,,郑州市第一〇七高级中学,郑州市二七区福华街街道苗圃街430号,刘志义,0371-86016100,郑州市公共资源交易中心,郑州市中原西路郑发大厦7018室,卢浩,0371-67110139
42,HQCG-2022-034,2022年09月08日,http://hngp.gov.cn/henan/content?infoId=1244573&channelCode=H680202,"1,2,3",3,,"山东德睿科教设备有限公司,新乡市杰立商贸有限公司,河南厚拓智慧信息技术有限公司","山东省菏泽市鄄城县郑营镇西街行政村西街村文化路中段路南,新乡市人民路 209 号金桂园 3 号楼 10 层 03 户,河南省新乡市新飞大道 1789 号高新区火炬园 H2 座(A-C)(201-207)-197","教学设备、体育器材、课桌凳等（详见采购需求）,智能黑板、笔记本电脑、高清解码器等（详见采购需求）,录播教室、监控、光纤等 （详见采购需求）","1199000.00,775000.00,997636.00",,新乡市红旗区洪门镇中心学校(新乡市红旗区洪门镇初级中学）,新乡市新五街与人民路交叉口,张凯丽,18537330623,中大宇辰项目管理有限公司,河南省郑州市金水区金水东路与通泰路蓝天空港1-1-901,胡一凡,15515921890
43,豫财招标采购-2022-627,2022年09月02日,http://hngp.gov.cn/henan/content?infoId=1243871&channelCode=H600102,1,1,,河南亚控科技有限公司,郑州市金水区俭学街2号院2号楼4层403室,河南科技大学“中国道路”虚拟仿真平台项目和高性能计算机项目采购项目包1,770000,,河南科技大学,洛阳市洛龙区开元大道263号,黄老师,0379-65627683,河南省公共资源交易中心,郑州市经二路12号,王老师,0371-65915565
